{
  "schemaVersion": "1.0.0",
  "modelId": "nitric-oxide-vascular-tone",
  "modelVersion": "0.1.0",
  "name": "Nitric oxide and vascular tone tendency",
  "pathway": "Nitric oxide / vascular tone",
  "profileGroup": "MetaboBrief starter pathway profile",
  "status": "experimental",
  "algorithm": {
    "id": "group-capped-normalized-sum",
    "version": "1.0.0"
  },
  "variantContributionModelVersion": "legacy-v0",
  "compatiblePanelVersion": "0.3.0",
  "biologicalQuestion": "Do the curated SNP findings favor lower or higher modelled nitric-oxide and vascular-tone constraint?",
  "negativePole": "Lower modelled nitric-oxide or vascular-tone constraint",
  "positivePole": "Higher modelled nitric-oxide or vascular-tone constraint",
  "includedMechanisms": [
    "NOS context",
    "arginine pathway context",
    "vascular signalling context"
  ],
  "excludedMechanisms": [
    "Blood pressure readings",
    "endothelial testing",
    "medications",
    "cardiovascular diagnosis"
  ],
  "defaultProfile": "conservative",
  "minimumCoverage": 0.25,
  "minimumIndependentSignals": 1,
  "minimumEvidenceQuality": 0.3,
  "maximumGroupContribution": 0.5,
  "inputs": [
    {
      "rsid": "rs1799983",
      "claimIds": [
        "rs1799983_GG_enzyme_activity",
        "rs1799983_GT_enzyme_activity",
        "rs1799983_TT_enzyme_activity"
      ],
      "contributionStates": {
        "rs1799983_GG_enzyme_activity": "supported_baseline",
        "rs1799983_GT_enzyme_activity": "insufficient_evidence",
        "rs1799983_TT_enzyme_activity": "scored"
      },
      "axisMultiplier": 1,
      "mechanism": "nos3-enzyme-activity",
      "independenceGroup": "nos3-enzyme-activity",
      "modelWeight": 1,
      "profiles": [
        "conservative",
        "exploratory"
      ],
      "profilesByClaimId": {
        "rs1799983_GG_enzyme_activity": [
          "conservative",
          "exploratory"
        ],
        "rs1799983_GT_enzyme_activity": [
          "exploratory"
        ],
        "rs1799983_TT_enzyme_activity": [
          "conservative",
          "exploratory"
        ]
      },
      "inclusionRationale": "Included because the starter SNP panel assigns NOS3 rs1799983 to Nitric oxide / vascular tone with explicit genotype contribution components."
    }
  ],
  "interpretationBands": [
    {
      "min": 0,
      "max": 39,
      "label": "toward lower modelled nitric-oxide or vascular-tone constraint"
    },
    {
      "min": 40,
      "max": 60,
      "label": "near the model midpoint"
    },
    {
      "min": 61,
      "max": 100,
      "label": "toward higher modelled nitric-oxide or vascular-tone constraint"
    }
  ],
  "limitations": [
    "This is a relative pathway tendency within the MetaboBrief starter model, not a population percentile.",
    "This model combines curated SNP contribution components assigned to this pathway; it does not measure current pathway activity.",
    "The current browser analyzer still performs direct provider-native rsID matching without build or strand normalization.",
    "Not included: Blood pressure readings, endothelial testing, medications, cardiovascular diagnosis."
  ]
}
